|id|texto|fecha
983|1496657872595394563|De nuevo un desastre natural afecta al Eje Cafetero. Hoy en el barrio Centenario de Manizales, que tiene en vilo a las familias afectadas. Todos estamos deseando que los desaparecidos aparezcan con vida muy pronto.|2022-02-24 01:26:58+00:00
984|1496612344847339526|"Cuando llegamos a la Alcaldía de Medellín en el 2004 empezamos una transformación, y la comuna 13 es un emblema de todo lo que logramos con nuestra apuesta de infraestructura social. Lo hicimos aquí y también lo vamos hacer en el resto del país.

https://t.co/dw7cLRRqf4 https://t.co/mJdhwhNP5g"|2022-02-23 22:26:03+00:00
985|1496590790168137729|"Lo que logramos en Medellín y Antioquia fue potente. Llegó el momento de que se viva en todo el país. A Colombia la vamos a transformar.

https://t.co/dw7cLRRqf4 https://t.co/DuMd588q7v"|2022-02-23 21:00:24+00:00
986|1496558352733810691|El expresidente Gaviria está enfermo de poder y por eso está desvariando. No se puede hacer política con clientelistas ni corruptos. Quiero que las personas liberales voten por mí, pero libremente. No todo vale. Colombia va a cambiar pero no con los mismos para hacer lo mismo. https://t.co/XFSb3WJfr6|2022-02-23 18:51:30+00:00
987|1496517200760430595|Las consultas previas y consultas populares las vamos a apoyar, respetar y acompañar. Es una obligación la licencia ambiental y social. El gobierno no puede atropellar a las comunidades sino acompañarlas, solo así será posible el desarrollo del país. #DebateAmbiental2022|2022-02-23 16:07:59+00:00
988|1496514253829910535|En nuestro gobierno crearemos el gran Centro Nacional de investigación y desarrollo de la biodiversidad. Necesitamos un programa nacional de educación ambiental, de la mano de la ciencia y las comunidades, para conocer y valorar nuestra riqueza natural. #DebateAmbiental2022 https://t.co/azjs6oLYBk|2022-02-23 15:56:16+00:00
989|1496506643743395840|La biodiversidad es la gran oportunidad y hay que conocerla, conservarla y utilizarla sosteniblemente. Los pagos por servicios ambientales son una alternativa, pero no como única opción. Deben estar acompañados por restauración y oportunidades económicas de desarrollo para todos. https://t.co/aiZe2OvXRY|2022-02-23 15:26:02+00:00
990|1496502877300441093|Estableceremos la etapa de licenciamiento ambiental para la fase de exploración minera. Esto es un paso fundamental que además debe estar acompañado por el involucramiento y escucha a las comunidades. #DebateAmbiental2022 @UNALOficial @CiderUniandes|2022-02-23 15:11:04+00:00
991|1496502682579836938|Con la minería hay qué responder: ¿cómo y dónde? Empezaremos por definir, y hacer cumplir, las áreas donde no se permitirá la actividad minera. Hay ecosistemas clave en donde no se puede hacer minería, en los que sí avanzaremos con la formalización y apoyo a pequeños mineros.|2022-02-23 15:10:17+00:00
992|1496492199416152070|"Estamos ya en el #DebateAmbiental2022 desde la @UNALOficial.

Pueden verlo en vivo a través de mi página de Facebook https://t.co/zWyeQJlUaw y en YouTube https://t.co/0r7dUzpKdQ https://t.co/nEGIu850DS"|2022-02-23 14:28:38+00:00
993|1496475585568256001|"Hoy a las 9:00 a.m. estaré en el #DebateAmbiental2022 desde la @UNALOficial.

Pueden verlo en vivo a través de https://t.co/izVdJxk33u y en YouTube https://t.co/0r7dUzpKdQ

@idea_un @CiderUniandes @MovNalAmbiental https://t.co/xXcMl38K8e"|2022-02-23 13:22:37+00:00
994|1496467202890948614|El ELN nos está demostrando cada semana su desdén por la vida, la naturaleza y el bienestar de los colombianos. Su “lucha” armada quedó en puro terrorismo.|2022-02-23 12:49:18+00:00
995|1496300097155571719|Hoy estuvimos en Cúcuta. Este es un breve resumen de la jornada. https://t.co/GsBbFKW6Wy|2022-02-23 01:45:17+00:00
996|1496273674445496328|"Atalaya se tiñó de verde esperanza. Hablamos de la educación como motor de transformación social y los 10.000 mentores que diseñarán rutas de empleo para 1.500.000 jóvenes en nuestro gobierno.

https://t.co/dw7cLRRqf4 https://t.co/kwPGFyNUEC"|2022-02-23 00:00:18+00:00
997|1496257674387902471|"Estamos en el parque Santander hablando con cucuteños y cucuteñas de sus preocupaciones y nuestras soluciones. El próximo 13 de marzo pidan el tarjetón de la Coalición de la Esperanza y apuesten por un cambio sin odio y con experiencia.

https://t.co/dw7cLRRqf4 https://t.co/oAvDDAn6t9"|2022-02-22 22:56:43+00:00
998|1496235884877914120|Agradezco el apoyo de Rodrigo Pardo, Jose Antonio Ocampo, Pilar Gaitán y el destacado grupo de internacionalistas que nos han permitido construir una propuesta de gobierno que permitirá que Colombia vuelva a tener un rol relevante y positivo en el ámbito global. https://t.co/rMflqePF0V|2022-02-22 21:30:08+00:00
999|1496230426293280770|Los corruptos no solo se roban la plata: atentan contra todos los colombianos. Un ejemplo reciente es el de Centros Poblados. En la @unisimoncucut expliqué la necesidad de reparar a las víctimas de la corrupción inmediatamente. El Estado no puede esperar hasta recuperar la plata. https://t.co/b6QrSe6J9K|2022-02-22 21:08:26+00:00
1000|1496166091441254403|"Coincidí con @JERobledo en la @CCCucuta. Ahí expresé que voy a apoyar a sus microempresas con líneas especiales de crédito, programas de formación para el trabajo y su capacidad de innovación para que brille el talento cucuteño.

https://t.co/dw7cLRRqf4 https://t.co/wTAeWdBbHR"|2022-02-22 16:52:48+00:00
1001|1496142771131981831|"La esperanza ya tiene sede en Cúcuta. Vamos a transformar a Norte de Santander con un enfoque territorial, y  se beneficiará de los 440.000 nuevos puestos de trabajo que crearemos en todo el país con proyectos públicos para reactivar el empleo.

https://t.co/dw7cLRRqf4 https://t.co/SC4fH8tY39"|2022-02-22 15:20:08+00:00
1002|1496123902522802182|Cúcuta ha pagado las consecuencias de la diplomacia fallida de Duque con Venezuela. No tengo ninguna simpatía por el gobierno de Maduro, pero hay que restablecer los canales diplomáticos, tramitar las diferencias, abrir la frontera y reactivar los consulados. https://t.co/GEI4NBlEvr|2022-02-22 14:05:09+00:00
1003|1496109667122126848|"Acá dejo un resumen de cómo trabajamos con las maestras y los maestros en Antioquia. La educación es la revolución.

https://t.co/q4YPiey8lY"|2022-02-22 13:08:35+00:00
1004|1496109665259859979|Los docentes son los héroes de la sociedad y los ejes sobre los cuales articularemos la transformación de Colombia. En mi gobierno reconoceremos y trabajaremos con los 480.000 que hay para que sean cada vez mejores. Lo hicimos en Antioquia y lo haremos en todo el país. https://t.co/RBfpN6Akup|2022-02-22 13:08:35+00:00
1005|1495877699394576391|Trabajaremos con jóvenes en cuidar y decidir sobre sus cuerpos, llevar una vida sin violencias y tener una sexualidad enfocada en la prevención de embarazos no deseados, y mejoraremos los servicios de salud urbanos y rurales para que las mujeres reciban la atención que merecen.|2022-02-21 21:46:50+00:00
1006|1495877697322508296|Acierta la Corte Constitucional al despenalizar el aborto porque es, ante todo, un asunto de salud pública. Las mujeres tienen la capacidad de decidir sobre sus cuerpos y lo que necesitan es que los procedimientos sean legales, seguros y no les representen ningún riesgo.|2022-02-21 21:46:49+00:00
1007|1495858394657398784|El Estado ni siquiera sabe cuáles son sus baldíos, que son la puerta de entrada a la deforestación. Por eso implementaremos el 100 % del catastro multipropósito e impulsaremos el programa de restauración, un área crucial en la generación de empleo.|2022-02-21 20:30:07+00:00
1008|1495858391029362696|La deforestación es el problema ambiental más grave del país. Vamos a buscar y judicializar a los corruptos, criminales e ilegales que están detrás de la pérdida de bosques con los incendios forestales. https://t.co/w3JrhEBaEu|2022-02-21 20:30:06+00:00
1009|1495797885623017473|Las mujeres deciden sobre su cuerpo. https://t.co/GzbZqz0TJ9|2022-02-21 16:29:41+00:00
1010|1495783382420271108|Creo en una forma distinta de hacer política, una donde NO todo vale para ganar. En mi equipaje van los mismos principios, y por eso voy a ser presidente de Colombia. Con las bodegas encima, los insultos, las agresiones, sigo, tranquilo, caminando por este camino. https://t.co/w3oYJhIpn7|2022-02-21 15:32:03+00:00
1011|1495747505723748354|En Colombia siempre ha habido una división entre la educación pública y la privada. Ese modelo ha hecho que aumenten las desigualdades, pero eso se va a acabar porque mi gran proyecto es la educación como motor de transformación social. Vamos a trabajar con maestras y maestros. https://t.co/UJkw8dgXrp|2022-02-21 13:09:29+00:00
1012|1495576877976719361|Dice @agaviriau que no puedo cuestionar sus apoyos por tener investigaciones, investigaciones impulsadas por los corruptos a los que incomodo. Nadie puede decir que he entregado puestos o contratos. Nunca me he juntado con ellos para llegar al poder. Que quede claro: no todo vale https://t.co/eg80hba6fj|2022-02-21 01:51:28+00:00
1013|1495573212968767488|"Colombia tiene hambre. Debemos aumentar la capacidad de los comedores comunitarios del país, ajustar las transferencias monetarias al aumento de los precios de alimentos y, sobre todo, invertir en el campo y la industria para bajar precios y detener el hambre.

#ColombiaDecide"|2022-02-21 01:36:55+00:00
1014|1495563461283172354|"En Colombia la política tiene que ser distinta: sin corruptos, sin clientelismo y libre de clanes. Al poder se tiene que llegar, pero sin hacerles venias a los poderosos. Llegaremos con una forma diferente y libre de hacer política. Así cambiaremos al país.

#ColombiaDecide https://t.co/gMmwhuDJR1"|2022-02-21 00:58:10+00:00
1015|1495558176300843009|"Buenas noches. Sigan el debate organizado por @NoticiasCaracol y @lasillavacia donde participaremos los candidatos de la @CoaliEsperanza.

#ColombiaDecide 

#LaEsperanzaEsConFajardo 

https://t.co/D7oMf8DG3P"|2022-02-21 00:37:10+00:00
1016|1495481309086552064|Jairo Parada (@jparadacor) es un estandarte en Barranquilla de cómo la academia influye positivamente a la sociedad. Me da mucho gusto contar con su apoyo para lograr un cambio que no se le arrodilla a los politiqueros y corruptos. https://t.co/EQ7MyOS0Fc|2022-02-20 19:31:43+00:00
1017|1495437183695704068|Me siento muy orgulloso de compartir con @Julianelpolit, un señor que ama a Manizales, respeta la política distinta y quiere cambiar al mundo. Por eso va a llegar muy lejos. https://t.co/SXNx5vtUJ6|2022-02-20 16:36:23+00:00
1018|1495428330060984331|"1. Recuperación y transformación de la educación: https://t.co/E14loa40xO.

2. Mejoramiento de la enseñanza y apropiación de matemáticas: https://t.co/kwKOZcnuo8.

3. STEAM para incrementar la calidad educativa: https://t.co/bRHnhAr2HO.

La educación es la revolución."|2022-02-20 16:01:12+00:00
1019|1495428328160956422|"Así es, @juliandezubiria. Y es preocupante que no se hable de propuestas concretas para cambiar esta realidad. Comparto tres que implementaré en mi gobierno.

(Continúa)... https://t.co/XmwJgbfzeU"|2022-02-20 16:01:11+00:00
1020|1495418730456793092|En Cúcuta hay mucho miedo por culpa de la violencia. A los últimos atentados del aeropuerto y la Brigada 30 se suma el ataque a la estación de policía de Aguaclara. Mi solidaridad con los afectados y mi reconocimiento a los policías que evitaron que el hostigamiento fuera mayor.|2022-02-20 15:23:03+00:00
1021|1495184530461839396|La seguridad e integridad de los procesos de la @ComisionVerdadC son una obligación estatal esencial para garantizar el esclarecimiento de la verdad. Es la condición básica para construir la paz en nuestro país. https://t.co/pk521FPnVB|2022-02-19 23:52:25+00:00
1022|1495147060105986050|Las colombianas la tienen muy difícil con el empleo: tomen a un hombre y una mujer que hayan estudiado exactamente lo mismo y en la mayoría de los trabajos le pagarán mejor a él que a ella. En mi gobierno vamos a crear 1.500.000 nuevos puestos priorizando a jóvenes y mujeres. https://t.co/dYToAuIHLN|2022-02-19 21:23:32+00:00
1023|1495118578353328129|Pasamos por el centro comercial de cielos abiertos y hablamos con los comerciantes. Ellos se beneficiarán con las líneas especiales de crédito y los programas de formación que abriremos para apoyar a las microempresas colombianas y estimular el desarrollo económico. https://t.co/yOT4Fi6Er2|2022-02-19 19:30:21+00:00
1024|1495097542807371785|En medio del volanteo pude ver algo del partido. Golazo de Luis Díaz. https://t.co/yMVunDNPUx|2022-02-19 18:06:46+00:00
1025|1495077931009421323|"Estamos en el parque Fundadores explicando nuestras propuestas para el Quindío y Colombia. El próximo domingo 13 de marzo pidan el tarjetón de la Coalición de la Esperanza y apuesten por el cambio sin odio y con experiencia.

https://t.co/dw7cLRRqf4 https://t.co/A6OGnMVdPn"|2022-02-19 16:48:50+00:00
1026|1495046923383934981|Que lo que ocurrió en la UTP no perjudique a la inmensa mayoría de sus alumnos, quienes son pacíficos, respetuosos y tolerantes. Ella es Juanita Castrillón, estudia Ingeniería Física allá y me preguntó la diferencia entre mi candidatura actual y la anterior. Esto le respondí. https://t.co/Nhkj2pVN0E|2022-02-19 14:45:37+00:00
1027|1494805361966071813|"En el parque El Cable hablamos con las personas sobre cómo vamos a crear la universidad pública digital, cómo generaremos 1.500.000 de empleos y cómo gobernaremos sin clientelismo ni corrupción.

https://t.co/dw7cLRRqf4 https://t.co/vX5o6NkPyP"|2022-02-18 22:45:45+00:00
1028|1494781847678730249|"Ayer en Dosquebradas me encontré con un gran ídolo del ciclismo colombiano: Álvaro Mejía, quien ocupó el cuarto lugar en el Campeonato del Mundo de 1991 y en el Tour de Francia de 1993. Ahora es médico y sigue siendo un ejemplo a seguir.

https://t.co/dw7cLRRqf4 https://t.co/JCBFJ9jUMc"|2022-02-18 21:12:18+00:00
1029|1494767746244096002|La política del miedo, la rabia y el odio solo nos conducirá al abismo. No renunciaré a seguir escuchando el malestar que hay, porque es legítimo. Estoy preparado para unir a Colombia, curar sus heridas y liderar la verdadera revolución: la de la educación. https://t.co/DuJ6avRXrx|2022-02-18 20:16:16+00:00
1030|1494730727350484993|"Lo que pasó en la UTP es una expresión bárbara de la violencia política. En Colombia hay mucha rabia, pero debemos entender su naturaleza, sanar, unir y avanzar. Por eso salí tranquilo y volveré. Debemos ser capaces de ser diferentes sin ser enemigos.

https://t.co/nXLgVPcDwc"|2022-02-18 17:49:10+00:00
1031|1494721741108744198|Vamos a crear la universidad pública digital para que 100.000 jóvenes tengan la oportunidad de formarse con la misma calidad de las mejores universidades públicas. Con educación todo se puede. https://t.co/l3WWdyjk3s|2022-02-18 17:13:28+00:00
1032|1494710844608978953|Esta mañana retomamos nuestra agenda del Eje Cafetero en Manizales con un buen desayuno con Guido Echeverry, Julián García, Christian Pérez y sus equipos de trabajo. Hablamos sobre cómo lograr consolidar la región como un solo mercado económico. https://t.co/wBikFQA0Zf|2022-02-18 16:30:10+00:00
1033|1494698939991396353|Qué alegría. Ahí está: el Nevado del Ruiz. https://t.co/K0sjbiYpQA|2022-02-18 15:42:52+00:00
1034|1494650856070955011|Tremendo susto se llevó Senobia ayer, pero acá sigue trabajando con nosotros como hace más de 10 años. Siempre alegre y cariñosa. https://t.co/E74bCRUF8w|2022-02-18 12:31:48+00:00
1035|1494495119969595418|La buena noticia: sigo firme en la apuesta por la educación, en particular por la pública. Mi convicción ha sido, es y será la educación como motor de la transformación social. En resumen: la educación es la revolución.|2022-02-18 02:12:57+00:00
1036|1494493820255449101|No nos detendremos, nos reencontraremos con los estudiantes de la UTP en otra ocasión. Las universidades deben ser lugares de encuentro, de debate, de argumentos e ideas; nunca de la violencia o de la opresión.|2022-02-18 02:07:47+00:00
1037|1494493819018092547|Encapuchados nos forzaron a abandonar la UTP, algo que no nos había pasado jamás en ninguna universidad. Es una lástima que la violencia política y el odio hagan que unos pocos impidan el libre ejercicio de la democracia.|2022-02-18 02:07:47+00:00
1038|1494434115730477067|Mis banderas: la lucha contra la corrupción, la educación y el empleo. En mi gobierno reconoceremos las víctimas de la corrupción resolviendo sus necesidades, habrá educación universal entre los 3 y 5 años y una renta para adultos mayores. El cambio es sin odio y con experiencia. https://t.co/XnD8T8k5HZ|2022-02-17 22:10:33+00:00
1039|1494371621494267909|La @CConstitucional está cumpliendo 30 años protegiendo los derechos fundamentales de los colombianos. Mi felicitación y reconocimiento a cada magistrada y magistrado por el trabajo, siempre difícil, de defender la integridad y la democracia de nuestra Constitución Política.|2022-02-17 18:02:13+00:00
1040|1494355624796336134|En Pereira siempre estoy feliz. Hoy en las calles haciendo lo que sabemos hacer mejor: hablar con las personas y contarles cómo vamos a cambiar a Colombia sin odio, con propuestas claras para cada región. https://t.co/x2h2YmosF1|2022-02-17 16:58:39+00:00
1041|1494342223781146635|No estoy de acuerdo con la forma como Uribe hace política. Colombia va a cambiar y el primer paso para lograrlo es derrotando su continuismo en las elecciones. https://t.co/RpGZgCA516|2022-02-17 16:05:24+00:00
1042|1494338899438555142|Nuestra propuesta ya está lista. La pueden conocer aquí: https://t.co/10Rtenig6V.|2022-02-17 15:52:11+00:00
1043|1494333316308242433|Reduciremos las cargas de trabajos —no pagos— de las mujeres para que participen en la educación y el mercado laboral. Trabajaremos en salud sexual y reproductiva para disminuir el embarazo adolescente y enfrentaremos la violencia contra la mujer. Así vamos a cambiar a Colombia.|2022-02-17 15:30:00+00:00
1044|1494333313623883787|Nuestro compromiso es trabajar por la igualdad y los derechos de las mujeres. Todas las políticas sectoriales tendrán metas claras para superar desigualdades. El cuidado de las mujeres será un compromiso de todo mi equipo de gobierno.|2022-02-17 15:29:59+00:00
1045|1494333310029365250|La experiencia en Medellín y Antioquia con las secretarías de la mujer nos mostró el poder crucial de contar con una instancia al más alto nivel. A pesar de los discursos, las legislaciones y los recursos invertidos en promover esta agenda, los esfuerzos han sido insuficientes.|2022-02-17 15:29:59+00:00
1046|1494333306065735685|Propongo la creación del Ministerio de las Mujeres, que liderará esta agenda a nivel nacional coordinando los esfuerzos de todas las entidades de gobierno. El país requiere una institucionalidad fuerte, visible, que coordine la atención de las diferentes formas de desigualdad.|2022-02-17 15:29:58+00:00
1047|1494333301749780486|"La desigualdad sigue teniendo rostro de mujer. En mi gobierno las mujeres serán protagonistas como también lo fueron en nuestra Alcaldía de Medellín y la Gobernación de Antioquia. No hay avance o desarrollo posible dándole la espalda a más de la mitad de la población.

Abro 🧵. https://t.co/MTqoMTI4nj"|2022-02-17 15:29:57+00:00
1048|1494276565827563520|Maduro es un dictador, pero tenemos que empezar a restablecer canales diplomáticos para atender los graves problemas en la frontera. Con conciertos y acusaciones desde Palacio no se resuelven los problemas de las millones de personas afectadas.|2022-02-17 11:44:30+00:00
1049|1494276563008897026|Duque es un peso mosca que le anda declarando la guerra a Irán y Rusia con tal de congraciarse con los Estados Unidos, pero ni siquiera lo ha recibido el presidente Biden. Se la pasa ahora viajando y dando discursos sin reconocer su fallida relación con Venezuela. https://t.co/lt8Tw0t6ix|2022-02-17 11:44:29+00:00
1050|1494127893802278913|"Duque dice que capturaron a alias ""Jhonier"", pero en este mismo instante hay jóvenes sin oportunidades entrando a la criminalidad. Nuevos alias. Enfrentaremos el problema de manera integral con oportunidades educativas, de empleo, culturales y deportivas.

#LaHoraDeLasCoaliciones"|2022-02-17 01:53:44+00:00
1051|1494126531089686533|Detrás de la deforestación están las bandas criminales. Perseguiremos las cabezas de esta actividad criminal y no solamente judicializar los eslabones más débiles: recuperaremos la tierra de esas estructuras. El gran problema de Colombia surge en la tenencia de la tierra.|2022-02-17 01:48:19+00:00
1052|1494126529336520704|La deforestación es un asunto crítico. Nada mejorará si no se trabaja con las comunidades. Primero construiremos proyectos de vida para que las personas vivan dignamente de los bosques y sacaremos oportunidades adelante: pago por servicios ambientales, ecoturismo y bioeconomía.|2022-02-17 01:48:18+00:00
1053|1494122735236231172|"5. Trabajar con los 480.000 docentes para que sean cada vez mejores.

6. Plan Nacional de Matemáticas.

7. Apoyo de sostenimiento educativo a través de Jóvenes en Acción.

#LaHoraDeLasCoaliciones"|2022-02-17 01:33:14+00:00
1054|1494122733764071424|"Mis principales propuestas en educación son las siguientes: 

1. Cobertura universal educativa de 3 a 5 años.

2. Mejoramiento de al menos 10.000 sedes educativas.

3. Cumplir con llevar internet a todos los colegios.

4. Crear la universidad digital nacional con 80.000 cupos."|2022-02-17 01:33:13+00:00
1055|1494120442675798016|"Siempre he respondido por mis actos pero hay una persecución por parte de la Fiscalía que atenta contra mi buen nombre; lo que quieren es que me haga a un lado, pero no me voy a dejar sacar de los corruptos.

#LaHoraDeLasCoaliciones"|2022-02-17 01:24:07+00:00
1056|1494095587523837957|"Los invito a ver el debate de @Hora20 con @DianaCalderonF y la @CoaliEsperanza. Comienza a las 7:00 p.m. Nos vemos.

#LaHoraDeLasCoaliciones

https://t.co/39tFfkaaqC"|2022-02-16 23:45:21+00:00
1057|1494074672891285513|Pepe Toro es mi amigo desde que estábamos chiquitos. Crecimos juntos y nos apasiona la educación. Es un gusto para mí poder seguir compartiendo con él en la vida. https://t.co/hWRHPJDo9m|2022-02-16 22:22:15+00:00
1058|1494010169247817730|Colombia tiene que cambiar, pero debe hacerlo con mucha sabiduría: no puede seguir por la línea de este gobierno ni tampoco por la de quienes se aprovechan del malestar general para hacer explotar la rabia. Por eso representamos la esperanza de un cambio serio, sereno y seguro. https://t.co/iAN3h1X58x|2022-02-16 18:05:56+00:00
1059|1493992297331056644|Los precios de los insumos que necesitan los campesinos son tan altos que su producción no es rentable. Eso disminuye la producción y encarece los alimentos. Proponemos subsidiar los insumos y que sus productos lleguen rápido a consumidores mejorando 35.000 km de vías terciarias. https://t.co/9L6phapa4j|2022-02-16 16:54:55+00:00
1060|1493942477262315520|En Colombia no hay una institucionalidad fuerte que coordine todo lo que hay que hacer en materia de seguridad. El presidente Duque está paseando y su gobierno, que era el de la seguridad, va a entregar un país con miedo. https://t.co/jyLpuqbcDc|2022-02-16 13:36:57+00:00
1061|1493924498684489734|"Buenos días. En pocos minutos estaré con @MariaAlejaVM en su sección de #ConversacionesDePaís de @NoticiasCaracol. Nos vemos.

https://t.co/O2dLvOsZ0W"|2022-02-16 12:25:30+00:00
1062|1493742783848337411|"#AquíEstoyPor nuestro país, para que nos unamos y lo transformemos juntos. Porque estoy seguro de que somos más los que creemos que llegó la hora de la esperanza. Nosotros a Colombia la vamos a cambiar.

https://t.co/8uQBHA6FO2 https://t.co/iMoM6cnMDx"|2022-02-16 00:23:26+00:00
1063|1493733763351818243|Es emocionante reencontrarme con personas como Martín Alonso Parra, quien me acaba de mostrar esta foto que nos tomamos hace más de diez años aquí mismo, en Bucaramanga. Estos momentos solo los da la calle. Gracias, Martín. https://t.co/ig4y82xLEt|2022-02-15 23:47:36+00:00
1064|1493711546022825992|"Ahora estamos en la plaza Luis Carlos Galán conversando con bumanguesas y bumangueses. Esta forma de contactar a las personas es emocionante. Seguimos adelante transmitiendo confianza y esperanza.

https://t.co/dw7cLRRqf4 https://t.co/PHeew5Tpif"|2022-02-15 22:19:19+00:00
1065|1493646026670018561|"En la @unab_online tuvimos la oportunidad de hablar sobre las formas de la política y cómo la polarización divide el mundo en dos. Yo creo que todos podemos ser diferentes sin ser enemigos. Por eso las formas también son importantes.

https://t.co/dw7cLRRqf4 https://t.co/EhqDh3qYIa"|2022-02-15 17:58:58+00:00
1066|1493628091977154569|Estamos en el parque San Pío explicando, persona a persona, nuestras propuestas. Bucaramanga y Colombia van a cambiar. https://t.co/isiiUv7vaB|2022-02-15 16:47:42+00:00
1067|1493623967936090115|Colombia no se merece vivir bajo la violencia y la corrupción de clanes de ningún tipo. Nuestro país necesita sacudirse de todos esos males con un cambio de gobierno, sin odio y con experiencia. https://t.co/aVXBqfdpGw|2022-02-15 16:31:18+00:00
1068|1493589919343783942|La transacción que firmó el secretario de Hacienda de Medellín en mayo 2004 es una permuta de un lote adicional necesario para avanzar en la ampliación de Las Palmas por otros lotes que el Municipio ya había obtenido en 2003 y que no servían para la vía.|2022-02-15 14:16:00+00:00
