|id|texto|fecha
1349|1476320411155668992|El próximo año se cierra por fin un ciclo de poder que ha girado alrededor de la figura del expresidente Uribe. Y aunque me siga atacando con mentiras, su tiempo terminó. Invitados esta noche a ver la segunda parte en #PreguntaYamid. https://t.co/c5rWL8Q5Ux|2021-12-29 22:33:09+00:00
1350|1475222709005131789|El presidente 118 y la corrupción https://t.co/vj29ajWrQW|2021-12-26 21:51:16+00:00
1351|1474140696240181260|Se acaba otro año. Un 2021 difícil en muchos aspectos, pero aunque creyeron que nos iban a sacar del camino, se equivocaron. En 2022, Colombia va a cambiar. https://t.co/xIxLt8UkRu|2021-12-23 22:11:44+00:00
1352|1474054814623580185|Qué pobre entendimiento de la política, senadora. A partir del 2000 caminamos Medellín por 3 años y, a pie, les ganamos las elecciones. Pasamos del miedo a la esperanza. Eso de creer que un iluminado lo unge a uno es de otra época. Con razón se quedó usted en la Unión Soviética. https://t.co/Yw2YWt2ZiI|2021-12-23 16:30:29+00:00
1353|1473846569065762822|¿Qué le produce esto? ¿Qué busca en la vida con una ofensa tan fácil? ¿Alguna vez hemos hablado? ¿Qué le genera tanta rabia? De corazón, Wally, quiérase un poco. Algo no está bien en su vida. Ahora, si le sirve el insulto para superar algo, acá estoy a sus órdenes. https://t.co/oIEgtklcmG|2021-12-23 02:42:59+00:00
1354|1473678381711609860|No haré alianzas con Petro. Esta es una competencia política y será la gente la que decida. No se trata de un individuo que tenga la verdad revelada sino de qué equipo es capaz de cambiar a Colombia sin el todo vale, sin rabia y sin miedo. https://t.co/ETUfhTbp2f|2021-12-22 15:34:40+00:00
1355|1473440417765105664|Ah, otro que tiene que ver con lo de Pipe Córdoba. Le doy un consejo, expresidente Uribe: váyase a ver ballenas. https://t.co/WA9GX5G2ZU|2021-12-21 23:49:05+00:00
1356|1473362318042046464|Su tiempo es el pasado, su juez será la historia, y sus críticas son, más bien, elogios. Disfrute a sus nietos, expresidente, y dele paso al cambio que tendrá lugar en Colombia. Se llenó el vaso: no más miedo ni rabia. Feliz navidad. https://t.co/QfshdcBN4q https://t.co/W9Bua1v6vW|2021-12-21 18:38:45+00:00
1357|1473138126893768707|El humor Iván. Jaja. Feliz noche https://t.co/NqDG9OP6y2|2021-12-21 03:47:53+00:00
1358|1472749721798295555|Boric no ganó polarizando, ganó dialogando y escuchando. Boric no ganó promoviendo odio, sino esperanza. Tiene un reto gigante de unir al país y sacar la nueva constitución adelante. Felicitaciones Chile por su ejemplar democracia.|2021-12-20 02:04:30+00:00
1359|1472594070283374593|Creo que, de tanto taparse los ojos para aceptar alianzas cuestionables, no vio el hilo de respuesta. Calma, Gustavo, que ya vendrán los debates para profundizar, pero acá se lo dejo: https://t.co/qvHcenZZf0. Feliz navidad. https://t.co/weW0znhBpz|2021-12-19 15:46:00+00:00
1360|1472521290921779200|El año económico en perspectiva https://t.co/UJ2BDc7YuE|2021-12-19 10:56:48+00:00
1361|1472515460407173123|La historia de Luz Nellis, la maestra que halló la tierra prometida en Montes de María https://t.co/f72RumV6xB|2021-12-19 10:33:38+00:00
1362|1472292216437723140|Cada día que pasa, y cada ataque suyo, me reafirma que haber votado en blanco fue lo más responsable. Cambiar un populismo por otro era no cambiar nada. En 2022, por suerte, no tocará decidir entre esas opciones antidemocráticas. No más miedo, no más rabia. https://t.co/YY6wGkGtD6|2021-12-18 19:46:32+00:00
1363|1472212556559306752|Cuando sea presidente invitaré a los congresistas a trabajar juntos, sin puestos ni contratos. En Colombia debemos romper con el clientelismo que es la puerta de entrada a la corrupción y lo podemos hacer. https://t.co/owExQPJwZ8|2021-12-18 14:30:00+00:00
1364|1472197456892936196|"El propósito del señor Pipe Córdoba es que yo esté respondiendo por Hidroituango en plena campaña y que la gente piense ""lo están investigando, por algo será"", porque él sabe que la confianza es lo más valioso que he construido. He respondido y demostraré que está equivocado. https://t.co/2PsZqo4gJp"|2021-12-18 13:30:00+00:00
1365|1471994913453715461|Cada día que pasa en esta campaña estoy más convencido de que Colombia va a cambiar, y espero ser yo quien lidere esa transformación que el país necesita junto a lo que hemos construido desde la #CoaliciónCentroEsperanza. @WRadioColombia https://t.co/j85aK9vAAM|2021-12-18 00:05:10+00:00
1366|1471974705284460550|Federico Gutiérrez y yo estamos en lugares muy diferentes. Él hace parte de una coalición distinta a lo que hemos construido en la #CoaliciónCentroEsperanza. No somos continuismo, nosotros representamos cambio, porque Colombia va a cambiar en 2022. @WRadioColombia https://t.co/9ySMI87HsU|2021-12-17 22:44:52+00:00
1367|1471806360782360583|Buen día. Rumbo a La  W. Los invito a que escuchen la entrevista que me van a hacer Julio Sánchez C y su equipo. 👍|2021-12-17 11:35:55+00:00
1368|1471610024585834506|Lamentable, pero no sorprendente, que el Congreso de la República haya hundido el proyecto que buscaba reducir el receso legislativo. Colombia necesita congresistas comprometidos y que estén a la altura de su responsabilidad, no que se vayan de 'vacaciones' cuando deben decidir.|2021-12-16 22:35:45+00:00
1369|1471551362408329222|Y bueno, hablar de 'aborto cero' siendo hombre...|2021-12-16 18:42:39+00:00
1370|1471545005626081287|Hablar de 'aborto cero' es facilista y cruel. Como dice @FranciaMarquezM, termina siendo un cuento. Mientras tanto, miles de mujeres, especialmente las más pobres, siguen arriesgando sus vidas ante la imposibilidad de encontrar un aborto legal y seguro. El aborto debe ser legal. https://t.co/6x3nq5OMDn|2021-12-16 18:17:23+00:00
1371|1471508810137313280|Gracias a la @RevistaBOCAS por esta entrevista donde hablo sobre esta campaña, nuestro recorrido por la política y otros temas. https://t.co/9KNGyRYX9s|2021-12-16 15:53:34+00:00
1372|1471466968947568652|Oportunidades educativas, empleo y un sistema integral de cuidados son los tres ejes de nuestra propuesta 'Jóvenes en el centro de las oportunidades'. Bienvenidos sus comentarios y aportes: https://t.co/ZRT6nslu4g https://t.co/QpcSGMDqSv|2021-12-16 13:07:18+00:00
1373|1471270882597384193|Estos son los puntos claves de nuestra propuesta 'Jóvenes en el centro de las oportunidades' para 1,6 millones de jóvenes, especialmente mujeres. Pueden consultar aquí el documento completo: https://t.co/ZRT6nslu4g https://t.co/PZVoropSnd|2021-12-16 00:08:07+00:00
1374|1471259570714599427|Acá les comparto el enlace a mi página web con las propuestas que construimos. Bienvenidos sus comentarios: https://t.co/ZRT6nslu4g|2021-12-15 23:23:10+00:00
1375|1471259239800786950|En junio presentamos un plan de empleo juvenil que recibió más de mil comentarios suyos, que en su mayoría acogimos. Hoy lanzamos el resultado: 'Jóvenes en el centro de las oportunidades', una propuesta que incluye empleo, educación y un sistema integral de cuidados. https://t.co/hEolpWWY0g|2021-12-15 23:21:52+00:00
1376|1471183453320355855|7. Ten en cuenta impacto de tu propuesta sobre formalidad laboral y los precios de bienes y servicios que pagan todos los colombianos. Si la inflación se sale de control, el Banco de la República tendría que tomar medidas para controlarla, con efectos negativos sobre el empleo.|2021-12-15 18:20:43+00:00
1377|1471183452150145032|6. Todos queremos mejores salarios y más oportunidades de empleo para los trabajadores. Por eso, propusimos un programa de empleo de emergencia y esta semana presentamos el plan “jóvenes en el centro de las oportunidades”.|2021-12-15 18:20:42+00:00
1378|1471183450891816961|5. Salarios de los colombianos son bajos. La solución es más productividad, competencia, formación para el trabajo, desarrollo productivo y mejores condiciones laborales, no un incremento del salario mínimo casi 2 veces mayor al que acordaron los sindicatos con los empresarios.|2021-12-15 18:20:42+00:00
1379|1471183449725751302|4. Y dejo un dato no menor, para que midas el impacto de tu propuesta: el 70% del empleo en Colombia está en pequeñas empresas. Tu propuesta pondría una enorme carga a esas empresas, su capacidad de producir y de emplear a los colombianos.|2021-12-15 18:20:42+00:00
1380|1471183447943172103|3. La productividad laboral es un factor importante, pero no el único, pues varía mucho entre industrias. Un aumento brusco del salario mínimo podría afectar mucho más a los sectores y empresas que queremos apoyar: las pequeñas empresas con bajos niveles de productividad.|2021-12-15 18:20:41+00:00
1381|1471183446693363718|2. Entonces vamos por partes. Confundes -con frecuencia- lo deseable con lo viable. ¿Es deseable subir el salario de los trabajadores en 19%? Sí. ¿Es posible? No. Si fuera cuestión de prometer lo deseable, prometeríamos subir el salario mínimo en un 100%.|2021-12-15 18:20:41+00:00
1382|1471183444805918722|1. Siempre es incómodo en una campaña decir “es inviable” sobre todo en temas que la gente anhela y necesita, pero es lo responsable. Alguien acá va a llegar a la Presidencia y más vale que pase lo que proponemos o vamos a terminar con más rabia, más indignación y más estallidos. https://t.co/kklfKvbOZV|2021-12-15 18:20:41+00:00
1383|1471171280208633860|#ElInformedeONUes confirmación de que fuerzas del Estado violaron DDHH. Estas violaciones deben ser juzgadas y corregidas estructuralmente. Solo así se podrá recuperar la confianza de la ciudadanía y garantizar la seguridad. Los DDHH son condición básica para cualquier estado.|2021-12-15 17:32:20+00:00
1384|1470915007848361989|Hola, Yann. Un par de aclaraciones: claro que  las leyes son necesarias, pero en Colombia, sin voluntad política, desafortunadamente, tienen un alcance muy limitado. Recuerda la diferencia entre una condición necesaria y una condición suficiente. Feliz noche. https://t.co/DQeFGqPGcY|2021-12-15 00:34:00+00:00
1385|1470751573332615178|Otra vez el dolor en Cúcuta. Mis condolencias con las familias de los policías asesinados hoy. La falla es sistémica y reiterada, igual que la incapacidad del gobierno nacional para cuidar a la atribulada y relegada Cúcuta.|2021-12-14 13:44:34+00:00
1386|1470568128002338819|Seguro si Duque habla de aumentar el salario mínimo en 18.5%, Petro sale a solicitar 28%. No importa la justificación ni los efectos, es la subasta del populismo. https://t.co/312fhQkDOW|2021-12-14 01:35:38+00:00
1387|1470522311547789312|Sumercé, con paciencia, todo se puede. https://t.co/w6zerOTsbr|2021-12-13 22:33:34+00:00
1388|1470438722361511940|El día en que yo me acueste pensando por quién voy a votar en segunda vuelta, al otro día me quedo acostado y no hago más campaña. Espero ser yo quien esté ahí por la #CoaliciónCentroEsperanza y vamos a ganar la presidencia. #ElDebate @RevistaSemana https://t.co/lApF4eFLgD|2021-12-13 17:01:25+00:00
1389|1470400616618942469|Nunca me sentaría con César Gaviria a negociar cuántos votos tiene. Nadie tiene votos de nadie. Nosotros sacamos muchos en 2018, y vivo muy agradecido por eso, pero esos votos no son míos: son de ustedes, son de la gente. #ElDebate @RevistaSemana https://t.co/dy3Z0QqVVH|2021-12-13 14:30:00+00:00
1390|1470393066733330435|Colombia va a terminar este año viendo a la #CoaliciónCentroEsperanza como la opción ganadora. Estamos listos para gobernar, para construir y transformar a este país, y estoy seguro de que se podrá con el apoyo de la gente. #ElDebate @RevistaSemana https://t.co/yTUTr1tzj9|2021-12-13 14:00:00+00:00
1391|1470385522782588928|Entiendo el susto de padres y madres frente a la discusión de la regulación de las drogas, pero hay una forma de enfrentar esos miedos. La educación es el principal antídoto para vivir sin miedo y podemos hacer pedagogía alrededor de estos temas. #ElDebate @RevistaSemana https://t.co/zKURmKcTKP|2021-12-13 13:30:01+00:00
1392|1470378183337857027|Si no identificamos hacia dónde va la plata podemos quedarnos toda una vida sin avanzar en la guerra contra el narcotráfico. La sustitución de cultivos también es clave para avanzar en el tema. Mis opiniones en #ElDebate @RevistaSemana https://t.co/6SItSGLmuU|2021-12-13 13:00:51+00:00
1393|1470223727690498056|Terminamos #ElDebate en @RevistaSemana. Muy nutrido y variado. Gracias a las personas que se conectaron y gracias a la gente de @compromisociu que nos acompañaron en el estudio. https://t.co/OntJncwi0U|2021-12-13 02:47:06+00:00
1394|1470214595029741569|La discusión del salario mínimo no debe iniciar en diciembre. Por supuesto hay que tener en cuenta cifras como la inflación, pero esto no puede volverse una competencia por ver quién sube más, esto debe hacerse con rigor. #ElDebate @RevistaSemana https://t.co/ul1terL5DV|2021-12-13 02:10:49+00:00
1395|1470208058961891331|El primer paso para luchar contra la corrupción es la voluntad política de quien gobierna, es clave para devolverle a la gente la confianza en las instituciones. Lo hicimos en Medellín, lo hicimos en Antioquia y lo haremos en la presidencia. #ElDebate @RevistaSemana https://t.co/mk9NUaU4Cl|2021-12-13 01:44:51+00:00
1396|1470198859964076036|Empezamos en la política hace 22 años, transformamos Medellín y Antioquia con @compromisociu a pie, con la gente en la calle y entregando volantes. Estamos aquí por convicción, porque se puede transformar la política. #ElDebate @RevistaSemana https://t.co/osmiOzDX8q|2021-12-13 01:08:17+00:00
1397|1470195733953404940|Los votos no son de un líder político o de un partido, los votos hay que trabajarlos, lucharlos en la calle. Los votos son de la gente. #ElDebate @RevistaSemana|2021-12-13 00:55:52+00:00
1398|1470194919776174089|Hemos sido claros: chao expresidentes. Colombia debe hablar de otros temas, superar esa página. Vamos a transformar y a convocar porque aquí está el cambio que necesita el país. #ElDebate @RevistaSemana|2021-12-13 00:52:38+00:00
1399|1470192615761096705|El nombre Esperanza en esta Coalición no es en vano. Representamos un cambio para transformar, un cambio para construir. Falta mucho camino, pero estoy seguro de que aquí está el próximo presidente de Colombia. #ElDebate https://t.co/6Zz2XtyjmW|2021-12-13 00:43:29+00:00
1400|1470183325516058627|Pueden ver #ElDebate también en el Twitter de @RevistaSemana. https://t.co/rFRmm7XoFp|2021-12-13 00:06:34+00:00
1401|1470182152629374986|"Empezamos #ElDebate en @RevistaSemana con @VickyDavilaH y la #CoaliciónCentroEsperanza. 

Pueden vernos aquí: https://t.co/vX61eGClTa https://t.co/2WNk7Yyidf"|2021-12-13 00:01:54+00:00
1402|1470121276878512134|La experiencia en Medellín y Antioquia nos mostró el poder transformador de contar con una instancia de alto nivel para las mujeres. Por eso proponemos este Ministerio para que la reducción de las desigualdades contra ellas sea una prioridad transversal de todo el gobierno. https://t.co/jj10Xj2opE|2021-12-12 20:00:00+00:00
1403|1470076215067389957|La invitación para que se conecten esta noche a las 7:00 p.m. en #ElDebate de @RevistaSemana con la #CoaliciónCentroEsperanza. Allí estaremos para contarles lo que proponemos para el 2022. Colombia va a cambiar. https://t.co/xTIsOqRCjH|2021-12-12 17:00:57+00:00
1404|1470051742607892480|Tengo la convicción de que la ciencia, la tecnología y la innovación son claves para el desarrollo del campo en Colombia. En el Valle del Cauca hay modelos que se destacan y que pueden ser ejemplo desde las regiones para lograrlo en todo el país. https://t.co/hmj0dLiTzs|2021-12-12 15:23:42+00:00
1405|1469796636100632577|Mañana domingo estaremos con la #CoaliciónCentroEsperanza en #ElDebate, transmitido en vivo por las redes sociales de @RevistaSemana desde las 7:00 p.m. para hablar de nuestras propuestas. Colombia va a cambiar. https://t.co/IMJY4sywxT|2021-12-11 22:30:00+00:00
1406|1469667438346317829|Esta semana presentamos nuestra propuesta del Ministerio de las Mujeres. Les invito a escuchar a @ROSAINESOSPINA1 quien ha sido parte de la construcción del documento que está disponible en mi página web: https://t.co/30UE3T5bil @Compromisarias https://t.co/8dkqRPriPP|2021-12-11 13:56:37+00:00
1407|1469449460048703488|Redes sociales, marihuana y otros temas en la parte final del debate de anoche con la #CoaliciónCentroEsperanza #ColombiaDecide https://t.co/ctDWhvmAJD|2021-12-10 23:30:26+00:00
1408|1469366352813215747|Colombia debe incorporar la seguridad alimentaria como proyecto estratégico. De igual forma, la ciencia, la tecnología y la innovación deben ser aliadas en el desarrollo rural. #ColombiaDecide https://t.co/5NXYJisGOZ|2021-12-10 18:00:12+00:00
1409|1469349445636612101|No podemos seguir hablando de la polarización Santos-Uribe. Suficiente con eso, chao expresidentes. Tenemos que escribir otra página, avanzar en la consolidación de la paz, hablar de educación y otros temas. #ColombiaDecide https://t.co/aHj6u2aCdl|2021-12-10 16:53:01+00:00
1410|1469299611437133825|Nos han hecho creer que hay que pagar para lograr las cosas, y desde la #CoaliciónCentroEsperanza vamos a cambiar eso para romper con la política tradicional. Vamos a ganar en 2022 y convocaremos a todos los sectores para liderar la transformación de Colombia. #ColombiaDecide https://t.co/K1rPly3ZmT|2021-12-10 13:35:00+00:00
1411|1469293320308285450|Nos hemos ganado estar aquí porque hemos caminado, la hemos luchado y no somos herederos de nadie. Vamos a gobernar convocando y dialogando, sin dar un peso y sin repartir puestos, así podemos romper con el clientelismo y con la corrupción. #ColombiaDecide https://t.co/4FLLX8n85f|2021-12-10 13:10:00+00:00
1412|1469284141271240710|En @compromisociu hemos hecho política llegándole a la gente en la calle, con volantes y sin intermediarios. No ofrecemos mentiras ni dinero por votos, y así hemos liderado transformaciones y combatido el clientelismo y la corrupción. #ColombiaDecide https://t.co/8wrJl8zMua|2021-12-10 12:33:31+00:00
1413|1469278856821551110|Hace 22 años iniciamos en la política con un movimiento cívico e independiente. Derrotamos a las maquinarias en Medellín y Antioquia y lo seguiremos haciendo para llegar a la presidencia. Estamos listos para liderar el país. Colombia va a cambiar. #ColombiaDecide https://t.co/AGrsuU8tWX|2021-12-10 12:12:32+00:00
1414|1469110557022302208|Nosotros nos hemos ganado estar aquí, porque hemos caminado, porque la hemos luchado, porque no fuimos herederos de nadie. Nadie nos puso aquí, nadie nos dio plata para que estuviéramos acá. #ColombiaDecide @lasillavacia @NoticiasCaracol https://t.co/DMAzW4scVh|2021-12-10 01:03:46+00:00
1415|1469109640533364739|Tenemos que cambiar esa idea de que para gobernar a Colombia hay que repartir puestos en Bogotá. Nosotros vamos a convocar, a dialogar y a unir al país para transformarlo. #ColombiaDecide|2021-12-10 01:00:07+00:00
1416|1469100801570361349|Estamos listos, muy emocionante regresar a los debates de ideas y propuestas. En minutos empezamos en directo por @NoticiasCaracol y @lasillavacia. #CoaliciónCentroEsperanza https://t.co/2yyWpSx0hf|2021-12-10 00:25:00+00:00
1417|1469091058592227337|Llegando a @CaracolTV para el debate de hoy con la #CoaliciónCentroEsperanza. Nos vemos a las 7:30 p.m. por @NoticiasCaracol y @lasillavacia. https://t.co/sE6OziJarv|2021-12-09 23:46:17+00:00
1418|1468996366051409921|Pensiones, drogas, gabinete paritario y alianzas, la última parte de mi paso por #CandidatosEnLaRedacción @NoticiasRCN. https://t.co/7pqGw4DsnD|2021-12-09 17:30:00+00:00
1419|1468984380727169029|Nos vemos esta noche a las 7:00 con la #CoaliciónCentroEsperanza en directo por @NoticiasCaracol y @lasillavacia. https://t.co/nUMlyNPCjp|2021-12-09 16:42:23+00:00
1420|1468981709991563268|La política de relaciones exteriores de Duque con Venezuela no ha estado a la altura. Por más diferencias que tengamos entre países, las puertas no pueden estar cerradas. Se necesita el diálogo. #CandidatosEnLaRedacción @NoticiasRCN https://t.co/0cZemRr4zZ|2021-12-09 16:31:46+00:00
1421|1468973716453445632|Reforma Tributaria, vacunación y Ley de Garantías: aquí mis opiniones en #CandidatosEnLaRedacción @NoticiasRCN https://t.co/dHNo03uzCG|2021-12-09 16:00:00+00:00
1422|1468966167456927744|No soy ficha ni de Santos, de ni de Uribe, ni de Gaviria, ni de Pastrana. Chao expresidentes, que se alejen de la política. Nosotros hemos construido en @compromisociu un camino cívico e independiente que quiere liderar a Colombia. #CandidatosEnLaRedacción @NoticiasRCN https://t.co/sI3uHaX1Vu|2021-12-09 15:30:01+00:00
1423|1468958625305563141|Sobre el Esmad también hemos presentado propuesta: se debe reformar con un enfoque en DD.HH. También proponemos sacar a la Policía del Ministerio de Defensa, transformar la educación en la institución y recuperar la confianza de la gente. #CandidatosEnLaRedacción @NoticiasRCN https://t.co/hqpfz8xurT|2021-12-09 15:00:02+00:00
1424|1468943519091867649|Romaña, El Paisa e Iván Márquez son personas detestables para nuestro país, le hicieron trampa al acuerdo de paz. Mientras muchos excombatientes hoy en Colombia respetan lo acordado, ellos decidieron salirse y ahí están las consecuencias. #CandidatosEnLaRedacción @NoticiasRCN https://t.co/uwvU4Y5ufB|2021-12-09 14:00:01+00:00
1425|1468935968560451589|Creo en la paz, he tenido experiencias sobre temas de conflicto y creo que no se puede cerrar la puerta ante una posible negociación con el ELN siempre y cuando se cumplan unas condiciones mínimas entre las partes. #CandidatosEnLaRedacción @NoticiasRCN https://t.co/ODqNLxeDte|2021-12-09 13:30:01+00:00
1426|1468930987082096645|Hace poco presentamos nuestra propuesta para recuperar y transformar la educación en Colombia. En #CandidatosEnLaRedacción les cuento algunos de los puntos más importantes del documento que pueden consultar en mi página web: https://t.co/WzK0TOhare @NoticiasRCN https://t.co/SpoBqi6tt2|2021-12-09 13:10:13+00:00
1427|1468927453829767168|El panorama para la libertad de prensa en Colombia es preocupante. Mientras el Congreso aprueba artículos abiertamente inconstitucionales, la Fiscalía pretende inspeccionar las instalaciones de @NoticiasUno en busca de fuentes. Esta peligrosa línea no la podemos recorrer. https://t.co/nFjEGE5dbD|2021-12-09 12:56:11+00:00
1428|1468920972052946946|Mis procesos en Fiscalía y Contraloría no son por corrupción, eso es lo que buscan hacerle creer a la gente al investigarme en plena campaña. La riqueza más grande que tengo es la confianza y por eso me defiendo, doy la cara y respondo. #CandidatosEnlaRedacción @NoticiasRCN https://t.co/03eL3epeTc|2021-12-09 12:30:25+00:00
1429|1468913429691912201|Cuando gobernamos en Medellín y Antioquia tuvimos las notas más altas en transparencia y lucha contra la corrupción, dimos ejemplo y lo seguiremos haciendo cuando lleguemos a la presidencia. #CandidatosEnLaRedacción @NoticiasRCN https://t.co/0kwzEX3W88|2021-12-09 12:00:27+00:00
1430|1468762320553885699|Te rajaste en la más fácil, @RoyBarreras. Feliz noche.|2021-12-09 02:00:00+00:00
1431|1468726531019137033|Muchas gracias a @NoticiasRCN por invitarme a #CandidatosEnLaRedacción. Si se lo perdieron. aquí pueden ver la entrevista completa donde hablamos de educación, seguridad, paz y otros temas: https://t.co/JZgqAGe7Oq|2021-12-08 23:37:47+00:00
1432|1468723946564558850|"De la #CoaliciónCentroEsperanza saldrá el próximo presidente. Hemos construido una opción política para transformar al país y lo vamos a lograr en 2022. Colombia va a cambiar.

#CandidatosEnLaRedacción @NoticiasRCN https://t.co/JZgqAGe7Oq https://t.co/fb4PGENMnK"|2021-12-08 23:27:31+00:00
1433|1468717196192976902|Ya estamos en #CandidatosEnLaRedacción para hablar de nuestras propuestas y otros temas en @NoticiasRCN. https://t.co/ND6Cw03KOz|2021-12-08 23:00:41+00:00
1434|1468671728951906305|Nos vemos hoy a las 6:00 p.m. en las redes sociales de @CanalRCN @NoticiasRCN para contarles de mis propuestas y otros temas en #CandidatosEnLaRedacción, con @Maryaristizabal. https://t.co/0v86ulfj5k|2021-12-08 20:00:01+00:00
1435|1468627835455631362|El contacto con la gente en la calle es lo que más he valorado desde el día uno cuando empezamos a entregar volantes en Medellín. Gracias a todas las personas que nos escuchan y nos demuestran su apoyo. Colombia va a cambiar y será con la ayuda de ustedes. @Compromiso_Ant https://t.co/ImdJxsh8N0|2021-12-08 17:05:36+00:00
1436|1468307584964874247|Por favor no hagan una F con las velitas esta noche. Disfruten con sus seres queridos y eviten pelear por política.|2021-12-07 19:53:02+00:00
1437|1468265226571329547|Jaja quiero al pderoso DIM aunque gane https://t.co/XPgxK99SXM|2021-12-07 17:04:43+00:00
1438|1468215577776988160|Falta mucho aún por recorrer. A pesar de todas los obstáculos y ataques, seguimos enfocados en ganar la consulta de la #CoaliciónCentroEsperanza y ganar la presidencia en 2022. Colombia va a cambiar. https://t.co/GxzFqpVQkI|2021-12-07 13:47:26+00:00
1439|1468196988663615489|Ahora al aire en @BluRadioCo. Pueden escucharnos en https://t.co/CIWgQO37XM|2021-12-07 12:33:34+00:00
1440|1468192823656783873|Vamos a ir armando este rompecabezas. Muy extraño que Pipe Córdoba lleva desde 2016 acusándome de diferentes mentiras y que también juega un rol en este proceso de la Fiscalía por un crédito en dólares. @CaracolRadio @6AMCaracol|2021-12-07 12:17:01+00:00
1441|1468189736942645250|Al aire en @CaracolRadio @6AMCaracol. https://t.co/jISU3k2Fi3|2021-12-07 12:04:45+00:00
1442|1468184951053074434|Me estoy jugando la vida. Llevo 5 años con presión judicial permanente. Voy a seguir batallando y no voy a dejar que destruyan mi vida, mi reputación y mi recorrido demostrando que se puede hacer política decente. @lafm|2021-12-07 11:45:44+00:00
