|id|texto|fecha
515|1513357506613063685|@FajardoEsCambio GRACIAS por hacerlo posible. Este es el comienzo de una remontada exitosa #cambiemosconfajardo|2022-04-11 03:25:21+00:00
516|1513357286965710851|@DianaOrozco5 Un esfuerzo que vale todo! Estamos a nada de serlo todo! Vamos Carolina #cambiemosconfajardo|2022-04-11 03:24:28+00:00
517|1513357101892050944|@JuanPSandovalP Es el momento de Colombia 🇨🇴|2022-04-11 03:23:44+00:00
518|1513356987005906944|@LuisGMurillo Bien dicho!|2022-04-11 03:23:17+00:00
519|1513356876251082752|@SandovalMCamila Gracias Maria Camila por tu compromiso. Lo de hoy fue emocionante!|2022-04-11 03:22:50+00:00
520|1513356753123135488|@OsorioSst ✊|2022-04-11 03:22:21+00:00
521|1513356466010443776|@AleGomezValek @juanmanuelgalan Gracias Alexandra!|2022-04-11 03:21:12+00:00
522|1513356166151258125|@Edwin_MoraGomez @gabocifuentes @juanmanuelgalan @CristoBustos @Juan_Florez @JERobledo @LiliaDignidad @AlbaLuzPinilla @SandovalMCamila @pao_lopez21 @AndrahJ Casi me toca a mí 😂|2022-04-11 03:20:01+00:00
523|1513356076065992706|@AlvaroCastr0 @JERobledo @LuisGMurillo El indicado para liderar esta importante apuesta que hacemos para #LaRemontadaDeFajardo 💪|2022-04-11 03:19:39+00:00
524|1513355853205749767|@QueDiceSebas Esperanza + dignidad = Cambio para Colombia 💪|2022-04-11 03:18:46+00:00
525|1513352683750625282|@richizuluaga Qué emocionante saber esto. Un abrazo para ti Richi y para tu mamá. Vamos a cambiar a Colombia!|2022-04-11 03:06:11+00:00
526|1513346446854176769|@QueDiceSebas Bien Sebástian! Gracias por ser parte de este equipo de voluntarios dispuesto a cambiar a Colombia 🇨🇴 👏|2022-04-11 02:41:24+00:00
527|1513340238088843264|"Termino la semana sonriendo porque somos un equipo donde no hay caudillos, somos un equipo donde hay una ciudadanía dispuesta a cambiar a Colombia. Nuevamente lo repito: 

G R A C I A S 💚💜❤️ #CambiemosConFajardo"|2022-04-11 02:16:43+00:00
528|1513340235735867392|Mientras estábamos en el encuentro con voluntarias y voluntarios, esta imagen se robó las miradas: ella estuvo traduciendo en lenguaje de señas para una persona a su lado. Vamos a construir un país para todas y todos, donde una persona con discapacidad no se sienta en desventaja. https://t.co/tclgezXJth|2022-04-11 02:16:43+00:00
529|1513338005003640834|@JenniferPedraz @AngelaCruzB Gracias Jennifer! Así vamos uniendo voluntades 💪|2022-04-11 02:07:51+00:00
530|1513337748060577793|@CarlosAmayaR @LuisGMurillo @JERobledo @CoaliEsperanza @compromisociu @FirmesCCE @NoticiasUno @WRadioColombia @BluRadioCo @NoticiasCaracol Gracias Carlos por el apoyo y las palabras de compromiso 👏💪 Unidos en #LaRemontadaDeFajardo porque tenemos un proyecto claro de país 🇨🇴|2022-04-11 02:06:50+00:00
531|1513337438869020681|@SergioLeonardoB @LuisGMurillo @CoaliEsperanza Gracias Leonardo! Así es, nunca antes había tomado tanto sentido y relevancia. No vamos a repetir un gobierno más como este.|2022-04-11 02:05:36+00:00
532|1513330167921455108|@PaolaTV ❤️❤️❤️|2022-04-11 01:36:43+00:00
533|1513318599112413187|"Si algunos medios nos quieren invisibilizar, la ciudadanía se encarga de hacerse escuchar. ¡Somos tendencia #1 en Colombia! Gracias voluntarias y voluntarios. #CambiemosConFajardo 💚❤️💜

Pueden conectarse aquí: https://t.co/ZUdcT3XBDZ https://t.co/qiyNaSxtgc"|2022-04-11 00:50:44+00:00
534|1513316032605163523|Nos quieren sacar y acá estamos, sin asustarnos ni amilanarnos.  Terminamos esta semana con una extraordinaria reunión de voluntarios. La remontada ya está en acción. Imparable. #cambiemosconFajardo https://t.co/Fz4vO97ylL|2022-04-11 00:40:32+00:00
535|1513314123236450310|"Un éxito la convocatoria de voluntarias y voluntarios. ¡Colombia presente desde las regiones! Gracias a los equipos que lo hacen posible. #CambiemosConFajardo 

Pueden seguirlo a través de YouTube https://t.co/ZUdcT3XBDZ https://t.co/0DAlCMgUT7"|2022-04-11 00:32:57+00:00
536|1513272351760207874|Esta noche nos veremos con voluntarias y voluntarios de todo el país que son parte importante en esta remontada. ¡Vamos a ganar! Somos el cambio que Colombia necesita. @LuisGMurillo 🇨🇴 https://t.co/lvxjHOpzIl|2022-04-10 21:46:58+00:00
537|1513227059463606277|"Esta noche nos vemos. La remontada toma fuerza, día a día. Sin asustarnos, sin dejarnos intimidar por los ""poderosos"" que nos quieren sacar. Cero nervios. https://t.co/XJQe8o0YwH"|2022-04-10 18:47:00+00:00
538|1513188035701186561|Un ejército no puede asesinar civiles, robar y manipular cuerpos. Un Gobierno no puede presentar una acción desproporcionada y vil como un operativo exitoso. Un país no es viable si no corregimos y recuperamos la confianza en las instituciones. https://t.co/4LbtSGUEeU|2022-04-10 16:11:56+00:00
539|1513184035782246406|Quieren quitarnos del camino porque saben que somos capaces de ganarles. Nosotros sabemos remontar con el viento en contra y creemos que se puede cambiar sin depender de los poderosos o lanzarse al abismo. Nosotros somos el cambio real. https://t.co/WlyLu9wGxo|2022-04-10 15:56:02+00:00
540|1513158627116437507|@samuelazout Es ahora o nunca, Samuel. #EsteEsElMomento|2022-04-10 14:15:04+00:00
541|1513120525047980035|"Buena lectura para este domingo
https://t.co/PG85OYoclZ"|2022-04-10 11:43:40+00:00
542|1512997873763368960|@DCriss31 @EliCrH 😎💪🚵|2022-04-10 03:36:17+00:00
543|1512986388878311437|"Cierro el día con una palabra: 

G R A C I A S #LaRemontadaTour https://t.co/sNCaEZagvy"|2022-04-10 02:50:39+00:00
544|1512936461582147589|Llueva o truene, en #LaRemontadaTour estamos jugados por mostrarle a Colombia una opción ciudadana. Gracias, gracias, gracias por esta muestra de compromiso con la campaña y el país 👏👏 https://t.co/H08cmxB7mG|2022-04-09 23:32:16+00:00
545|1512906240430592000|#LaRemontadaTour ya empezó y necesitamos de tu apoyo para seguir pedaleando hasta la Casa de Nariño. ¡ÚNETE! Vamos a construir la Colombia que nos merecemos https://t.co/WzDFOvJ2EO https://t.co/QXKMKkqDLX|2022-04-09 21:32:10+00:00
546|1512900374801309699|@DuvanFrancoMen2 @LuisGMurillo @CoaliEsperanza @CarlosAmayaR @danielduquev 🔝😎|2022-04-09 21:08:52+00:00
547|1512886773805948940|"Hoy festejamos el triunfo de Daniel Martínez, celebramos con Sergio Higuita y Nairo Quintana y acompañamos la recuperación de Egan, no podemos olvidar a un campeón extraordinario: Cochise.
COCHISE RODRÍGUEZ, 80 años de historia – Revista Mundo Ciclístico https://t.co/CnitsWTqJn"|2022-04-09 20:14:49+00:00
548|1512874657405456385|Mi solidaridad con las familias de las víctimas del atentado en Ituango y con el Ejército. Ituango es un ejemplo claro de la Colombia olvidada que no vive en paz. Es urgente una intervención integral, no solo con fuerza pública, sino con programas sociales y oportunidades. https://t.co/YRc9vDd0mg|2022-04-09 19:26:40+00:00
549|1512848505999663114|A los ataques respondemos con alegría, porque nos enfrentamos a todos los obstáculos con la convicción de que vamos a remontar y Colombia va a cambiar. Hoy desde Urabá con @LuisGMurillo seguimos con #LaRemontadaTour. https://t.co/md1xW3fRPC|2022-04-09 17:42:45+00:00
550|1512847197691424770|@ruizjlrp @CatalinaSuarezB Era no, es el indicado, en presente 💪🚴‍♂️|2022-04-09 17:37:33+00:00
551|1512823816933842950|"""La seguridad no puede seguir atendiéndose desde la confrontación"", esto dijo mi coequipero  @LuisGMurillo. Reconocemos que hacer lo mismo no sirve y que para transformar a Colombia y cambiar la vida de millones de colombianas y colombianos, necesitamos políticas sociales. https://t.co/NwCxEIxg95"|2022-04-09 16:04:39+00:00
552|1512786466853826564|La mejor forma de conmemorar a las víctimas es llevando oportunidades a los territorios. En Urabá lo hicimos con un mar de oportunidades. #9A Día Nacional de la Memoria y Solidaridad con las #Víctimas https://t.co/iK7df4qsYL|2022-04-09 13:36:14+00:00
553|1512767847876997125|@juancarperez Claro que sí, Juan Carlos. Muchas gracias por el apoyo y por ponerte la camiseta en esta remontada. Un abrazo. https://t.co/YyaSM2Sfuo|2022-04-09 12:22:15+00:00
554|1512767387988336640|Hoy el destino es Urabá. Como Colombia, esta region está llena de oportunidades. Tiene todas las condiciones para un gran desarrollo con bienestar para su población. Pero ha sufrido todas las violencias posibles. Urabá y Colombia, en paz y con educación, son imparables. Se puede. https://t.co/67dkU4I06u|2022-04-09 12:20:25+00:00
555|1512765375259291649|El cambio en Colombia será con la educación. Es ahora o nunca. #FajardoPresidente https://t.co/OI4lKFahwY|2022-04-09 12:12:25+00:00
556|1512610141119692803|@adrianazafra @saritapalacio Gracias Adriana! Un abrazo para ti.|2022-04-09 01:55:35+00:00
557|1512598695438696450|Desde Urabá, como gobernador, demostramos que las regiones SÍ importan y deben ser parte de la planificación. A Urabá volveremos para llevar un mar de oportunidades con @LuisGMurillo. ¡#LaRemontada es ahora o nunca! https://t.co/PrcCxuEt7X|2022-04-09 01:10:06+00:00
558|1512590512410218501|@casallasfr @EliCrH @LuisGMurillo 👏|2022-04-09 00:37:35+00:00
559|1512565375648546828|Este es un tema fundamental para Medellín y muchas ciudades en Colombia que enfrentan problemas de calidad del aire, movilidad insostenible, inseguridad. Pero la solución no pueden ser promesas imposibles. Por ganar votos, estás cosechando una desilusión histórica.|2022-04-08 22:57:42+00:00
560|1512565374021218306|Prometer 5 cables sin explicar nada, sin precisar cuáles son, es irresponsable. Gobernar no es un juego de Nintendo. Por eso, nosotros apoyaremos decididamente la consolidación del sistema de transporte masivo articulándonos con el AMVA, las alcaldías, el Metro y otros.|2022-04-08 22:57:41+00:00
561|1512565372351877121|Sin duda, los cables han sido fundamentales para la ciudad. En mi alcaldía y la de @AlonSalazarJ pusimos el transporte público masivo como prioridad central con Metrocables, Metroplus, tranvía, bicicletas y andenes para los peatones. Impulsamos la movilidad integral y sostenible.|2022-04-08 22:57:41+00:00
562|1512565370753851401|Según el Plan Rector de Expansión y los expertos que han priorizado las obras, Medellín necesita el Metro Ligero de la 80 y el Tren del Río, además de una nueva estación entre El Poblado y la Aguacatala y la extensión de la línea A al Norte, entre otros.|2022-04-08 22:57:41+00:00
563|1512565368837099528|Medellín y el Área Metropolitana necesitan terminar el sistema de transporte público colectivo para varias zonas. El Metro tiene un plan robusto, lejos de la improvisación y de las promesas populistas.|2022-04-08 22:57:40+00:00
564|1512565366320504842|No, @petrogustavo. Colombia necesita ilusiones, pero no con propuestas irrealizables como trenes imposibles o empleo del Estado para todo el mundo. Medellín tiene retos de movilidad y calidad del aire, pero, ¿por qué salir a prometer 5 cables que parecen sacados del sombrero? https://t.co/9sgsJDCbOK|2022-04-08 22:57:40+00:00
565|1512556201351028739|@JHernandezAmin Es ahora o nunca. #LaRemontada va en serio|2022-04-08 22:21:14+00:00
566|1512532394326302720|@_ajaytuque @El_Pilon @AntonioSanguino Muchas gracias Rebeca, he seguido tus comentarios y el apoyo que has hecho a la propuesta de Centro desde hace varios meses. Es ahora o nunca que debemos unirnos por un cambio real en Colombia. Un abrazo.|2022-04-08 20:46:38+00:00
567|1512526999323037698|Estas son solo algunas de nuestras propuestas, con el objetivo de incrementar las capacidades, la autonomía y la calidad de vida durante el envejecimiento. Acá nuestra propuesta completa: https://t.co/ZEyxTX5yOZ (5/5)|2022-04-08 20:25:12+00:00
568|1512526998022852608|Vamos a reglamentar la Ley 2040 de trabajo del adulto mayor y promoveremos un plan de mentorías, en la que las personas mayores acompañen a jóvenes en la construcción de sus planes de vida. Esto permitirá que adultos mayores transmitan sus conocimientos y experiencias. (4/5)|2022-04-08 20:25:12+00:00
569|1512526996802310151|Queremos recuperar la atención médica para las miles de personas mayores que han reducido o aplazado sus consultas médicas y tratamientos por las cuarentenas y riesgos de la pandemia. Trabajaremos para que todas estén al día en sus chequeos médicos. (3/5)|2022-04-08 20:25:12+00:00
570|1512526995359416322|Nuestra propuesta de pilares busca generar un esquema progresivo y justo. Teniendo en cuenta las tendencias de envejecimiento de la población, es necesario que los montos ahorrados por la reforma sirvan para la sostenibilidad futura del sistema. (2/5)|2022-04-08 20:25:11+00:00
571|1512526993677553665|Gracias por la lectura de nuestra propuesta @KevinHartmannC. Como dices, queremos asegurar que las personas mayores tengan un ingreso, pero vamos más allá: queremos una red de protección social para la vejez que combata la situación indigna de muchos adultos mayores. 🧵 (1/5) https://t.co/v5fBF8fLUS|2022-04-08 20:25:11+00:00
572|1512520717811736576|Este fin de semana salimos a las calles del país. #EsteEsElMomento de demostrarle a Colombia que somos la mejor opción para liderar el cambio que tanto necesitamos. Arrancó #LaRemontadaTour y contamos contigo 🚴‍♀️. #FajardoPresidente https://t.co/3GNKCLNQDO|2022-04-08 20:00:15+00:00
573|1512509177264054287|Con la alegría que caracteriza a Colombia vamos por #LaRemontada 👏 Llegar a las regiones así es la forma de recuperar la confianza ciudadana. https://t.co/XmkDtMstoh|2022-04-08 19:14:23+00:00
574|1512503103702114311|Con Jorge hemos recorrido un camino que ha dejado una huella de transformaciones en Medellín. Los resultados que logramos y las oportunidades que generamos son nuestra mejor carta de presentación. #EsteEsElMomento de SERLO TODO. Gracias por este apoyo. https://t.co/mInqU16BWJ|2022-04-08 18:50:15+00:00
575|1512474729483059209|SER DE CENTRO es tomar decisiones con alegría, honrando el presente y el futuro de un país que no se resigna porque tiene ESPERANZA. Gracias Juan Carlos y @ferrojasparra por sumarse a #LaRemontada. https://t.co/UfJJPbn8pt|2022-04-08 16:57:30+00:00
576|1512449189007003652|Fui el primer alcalde cívico elegido por voto popular y cambiamos el rumbo de Medellín, pasamos del miedo a la esperanza. Y llegó la hora de hacer eso por toda Colombia. @Teleantioquia|2022-04-08 15:16:01+00:00
577|1512448317199949831|Nos quieren meter el cuento de que esto se acabó y que debemos escoger entre dos opciones. Nosotros lideraremos un cambio que sabe transformar, hemos demostrado que sabemos gobernar y entendemos la necesidad de construir la paz y luchar contra la corrupción. @Teleantioquia https://t.co/zoelEQR0Bq|2022-04-08 15:12:33+00:00
578|1512427386830270473|Lo que Duque anuncia con orgullo es: Otoniel se irá a Estados Unidos, será juzgado por narcotráfico y negociará una rebaja de pena a cambio de entregar plata y rutas. En unos años saldrá libre y con residencia gringa. Las víctimas en Colombia seguirán sin verdad y sin reparación.|2022-04-08 13:49:23+00:00
579|1512411030957273094|El invierno es un riesgo que no cesa en Colombia. 9 mil damnificados. 8 departamentos en alerta. 37 municipios con riesgo de deslizamiento en Antioquia. 46 muertos en lo que va del año. Debemos trabajar en prevención y estar alertas para que no se repita.|2022-04-08 12:44:23+00:00
580|1512411029413707781|Como antioqueño y como colombiano lamento profundamente la avalancha sucedida en Abriaquí. Mi solidaridad con las víctimas y sus familias. Estas tragedias se repiten una y otra vez: las temporadas de lluvia no nos pueden seguir costando vidas. https://t.co/ZbRcxFJHzu|2022-04-08 12:44:23+00:00
581|1512397418754674693|La discapacidad es un tema del que no se habla. Son millones de personas que tienen algún tipo de discapacidad. Estoy sentado en el avión y una pasajera me entrega este mensaje. En las calles me pasa lo mismo: no tienen voz. La semana entrante presentamos nuestra propuesta. https://t.co/KrkqgfQsIp|2022-04-08 11:50:18+00:00
582|1512394260607295492|Buenos días. Listos para iniciar hoy nuestro fin de semana por Medellín y Antioquia. ¡La remontada es con la gente! https://t.co/J4via1qHVu|2022-04-08 11:37:45+00:00
583|1512242401842286592|Es una lástima que @petrogustavo y @FicoGutierrez no le cumplan a las regiones. Nuestra responsabilidad es exponer propuestas y debatirlas de cara a la ciudadanía. Dimos nuestra palabra y trabajaremos para transformar a Colombia con experiencia y seriedad. #ElTiempoDeLasRegiones https://t.co/QfRcXwTNNI|2022-04-08 01:34:19+00:00
584|1512214113044340738|"En nuestro gobierno vamos a ayudar a gobernadores y mandatarios regionales a sacar adelante los proyectos que no se han podido terminar. Las obras no se pueden dejar abandonadas por falta de iniciativa o voluntad.

#ElTiempoDeLasRegiones
@CanalCapital @LaRegionCentral https://t.co/81JPwHsLLS"|2022-04-07 23:41:54+00:00
585|1512212186042716166|El primer paso que haremos en la Presidencia será convocar a todas las regiones para la construcción del Plan de Desarrollo. Estos anuncios no dan votos, pero se necesita que las regiones participen en la construcción de esta hoja de ruta. #ElTiempoDeLasRegiones @CanalCapital|2022-04-07 23:34:15+00:00
586|1512211127018700806|Estamos viviendo una crisis desde las regiones en Colombia. Lo que hoy pasa en el Chocó es dramático y cualquier sociedad decente tendría a ese departamento como tema prioritario. #ElTiempoDeLasRegiones @CanalCapital https://t.co/KSzufjW0j3|2022-04-07 23:30:02+00:00
587|1512206696373960704|Estamos en vivo en #ElTiempoDeLasRegiones por @CanalCapital. Pueden seguir este foro presidencial aquí: https://t.co/ftng3VP7WN|2022-04-07 23:12:26+00:00
588|1512195138461839365|"En minutos estaré en #ElTiempoDeLasRegiones para hablar de nuestras propuestas para las regiones de Colombia.

Transmisión en vivo por @CanalCapital. https://t.co/cN8foiMx8Q"|2022-04-07 22:26:30+00:00
589|1512191516680335362|El primer decreto cuando sea presidente será “Muchos ojos, pocas manos”, como una muestra de transparencia y dar ejemplo en la contratación con el Estado. Que todo se vea para luchar contra la corrupción. @ELTIEMPO|2022-04-07 22:12:07+00:00
590|1512189733836926983|Yo estoy aquí sentado porque creo que la educación, la ciencia, la tecnología, la innovación, el emprendimiento y la cultura tienen que ser la construcción de la riqueza de Colombia. @ELTIEMPO https://t.co/cI0CmmUGWC|2022-04-07 22:05:02+00:00
591|1512184785615171588|Estamos al aire en @ELTIEMPO para hablar de nuestra remontada que nos llevará a la presidencia. Pueden ver la entrevista aquí: https://t.co/RoPiKzvnFy|2022-04-07 21:45:22+00:00
592|1512141402746073098|@SandovalMCamila Qué buena foto👏|2022-04-07 18:52:59+00:00
593|1512141240137039872|@CamiloCalleO @LuisGMurillo Con un gran anfitrión 💪|2022-04-07 18:52:20+00:00
594|1512125754510921729|Casi me gradúo, casi logro el trabajo, casi... #NoMásCasi #EsteElMomento de serlo todo. https://t.co/DzUMZupxI4|2022-04-07 17:50:48+00:00
595|1512082418211057670|"Barranquilla tiene un lugar especial en mi corazón. Ahí nació el canto del ""presidente profesor"" en 2018, que me sigue llenando de orgullo. Hoy celebra 209 años y espero poder llevarle educación y oportunidades cuando cumpla los 210. https://t.co/x6TWKmE4OQ"|2022-04-07 14:58:36+00:00
596|1512062263343022096|#EsteEsElMomento de las propuestas. Anoche con @agaviriau, y más de 200 personas de la academia y expertos en políticas públicas, discutimos y alimentamos nuestro plan de gobierno para solucionar los problemas de la gente. Aquí les dejo el resumen 👉🏽 https://t.co/IJQA8Eo3BF https://t.co/C5Mo7hIrA2|2022-04-07 13:38:30+00:00
597|1512046482748284931|Un silencio elocuente entre tanto ruido de 'maquinarias'. https://t.co/qm9OErpYBq|2022-04-07 12:35:48+00:00
598|1511898393643208714|"Dicen que solo los académicos leen los programas de gobierno. 

Les invito a conocer nuestro programa para transformar a Colombia. Aquí les dejo el link para descargarlo. Tranquilos, no son 400 páginas. #EsteEsElMomento de las propuestas 👉🏽 https://t.co/IJQA8E6sK7 https://t.co/OeEiTf7kU6"|2022-04-07 02:47:21+00:00
599|1511815143306452994|Dicen que nadie se lee un programa de gobierno pero los estudiantes de la @unab_online hicieron la tarea. Me voy feliz de Bucaramanga. Tenemos las mejores propuestas y quiero que las conozcan. A propósito, ¿ya vieron el resumen del plan de gobierno? 👉🏽 https://t.co/IJQA8E6sK7 https://t.co/UbcxSiU0s5|2022-04-06 21:16:32+00:00
600|1511729304736092161|Me da mucho gusto estar como invitado en la @unab_online para hablar de nuestras propuestas. Pueden ver la transmisión en vivo aquí: https://t.co/oz4EiP8ZPA|2022-04-06 15:35:27+00:00
601|1511715868346101772|Necesitamos una Consejería Especial de Seguridad para el Chocó para poder responder a la profunda crisis de seguridad que vive el departamento. No podemos seguir contando masacres ni vidas que se apagan. #SOSChocó (2/2)|2022-04-06 14:42:03+00:00
602|1511715867012345861|La violencia no puede seguir tomándole ventaja al presidente Duque. Se normalizaron las masacres y los consejos de seguridad cuando ya es tarde y no sirven para nada. Mi solidaridad con las familias de las víctimas en Chocó. (1/2) https://t.co/qS8YivkxYm|2022-04-06 14:42:03+00:00
603|1511524677545512961|"MENOS BALAS, MÁS EDUCACIÓN.

#EsElMomento de darle una oportunidad diferente a Colombia que no nos encierre entre los extremos. En Medellín la Comuna 13 hizo de su historia una oportunidad para sanar y salir adelante, en Bucaramanga el arte también se convierte en oportunidades. https://t.co/NCrx7fRwf8"|2022-04-06 02:02:20+00:00
604|1511511722284265479|#EsElMomento de hacer de la alimentación escolar una prioridad para el país 🇨🇴 ¡Sin una buena alimentación nuestras niñas, niños y jóvenes no van a poder desarrollar sus capacidades! https://t.co/7adepX4v7Z|2022-04-06 01:10:51+00:00
605|1511489298570297344|El @NvLiberalismo se pone la camiseta para la remontada. Nos convoca un país que pide transformaciones reales, sin propuestas improvisadas y enfocados en la educación para enfrentar la pobreza y la desigualdad. #EsteEsElMomento https://t.co/qCQPwF7wRJ|2022-04-05 23:41:45+00:00
606|1511450562990166020|"¡Hoy les invito a sumarse a #ElParcheDeFajardo📢! En esta campaña la juventud será protagonista y tenemos las mejores propuestas para ustedes. 

Jóvenes de todo el país, estudiantes, lideresas, construyamos juntos esta apuesta de cambio.💪🏼

¡INSCRÍBETE!➡️ https://t.co/spIj7ctfhD https://t.co/t4HWFrwoEx"|2022-04-05 21:07:50+00:00
607|1511445427492642823|Gracias @MauriceArmitage por tu apoyo incondicional a esta campaña. Compartimos muchas ideas y nos une el deseo de querer trabajar por Cali. #EsteEsElMomento de cambiar a Colombia desde las regiones. https://t.co/nF7jNclKB9|2022-04-05 20:47:25+00:00
608|1511436537648627714|"Sigue la remontada en Bucaramanga. Estamos al aire en @vanguardiacom para hablar de nuestras propuestas y el cambio que lideraremos en Colombia. 

Pueden ver la entrevista aquí: https://t.co/6BB97klgK0"|2022-04-05 20:12:06+00:00
609|1511375764230389769|Revisaremos la regulación actual de los fondos privados para reducir los costos y aumentar la competencia. Pueden leer nuestras propuestas completas  aquí: https://t.co/W8kbssfft4 https://t.co/ZEyxTX5yOZ (4/4)|2022-04-05 16:10:36+00:00
610|1511375762846273551|Para ello, generaremos 1,5 millones de empleos formales y dignos. Garantizaremos un ingreso básico de 500 mil pesos para todas las personas mayores de 65 años que no alcancen a pensionarse. Los primeros dos salarios mínimos de todos los trabajadores irán a Colpensiones. (3/4)|2022-04-05 16:10:36+00:00
611|1511375761478934544|Nuestra propuesta es respetuosa de las pensiones de los colombianos y colombianas. Buscaremos ampliar la cobertura de nuestro sistema pensional, aumentar el monto de las pensiones y reducir las inequidades del sistema actual. (2/4)|2022-04-05 16:10:36+00:00
612|1511375759860023311|Duque haciéndole campaña a Petro: la respuesta a una mala idea no puede ser otra mala idea. Esta foto sienta una mal precedente, las pensiones de los colombianos no deben responder a los intereses del gobernante de turno sino, únicamente, a criterios técnicos. (1/4) 🧵 https://t.co/VojCMNQMDj|2022-04-05 16:10:35+00:00
613|1511349351951568898|¡La remontada arranca en Santander! Esta mañana sobrevolamos parte del departamento para llegar a Barrancabermeja y hablar con pescadores, comerciantes y habitantes. #EsteEsElMomento https://t.co/9oszrqSWiC|2022-04-05 14:25:39+00:00
614|1511171971886858247|#EsteEsElMomento de unirnos. Con @agaviriau coincidimos en el deseo de construir un país donde cuenten las ideas de todas y todos. Con el equipo de @ColombiaFuturo_ también arranca la remontada ¡y lograremos el país que nos merecemos! https://t.co/2Lw3Vdwndz|2022-04-05 02:40:48+00:00
615|1511136142510460935|Juanes, sobrado. Siempre vigente. Felicitaciones. https://t.co/qNW9ugCFns|2022-04-05 00:18:26+00:00
616|1511114210150858757|Hoy definimos el papel del @NvLiberalismo en esta remontada. Además de @juanmanuelgalan y @MabelLaraNews, se suman @CarlosFGalan para temas de Bogotá, @sandraborda en las propuestas y temas programáticos, y concejales y representantes del partido. Vamos a la calle, vamos a ganar. https://t.co/FwR7dKFVMT|2022-04-04 22:51:17+00:00
617|1510989824169283588|¿Cuánto más hay que esperar para que el presidente, el ministro de Defensa y quienes ordenaron la operación  reconozcan el asesinato de civiles en Putumayo? Cuidar las instituciones empieza por tener cabezas que asuman responsabilidades y en este caso no está pasando. https://t.co/snBHPERiQ7|2022-04-04 14:37:01+00:00
